{
  "format": "kalup.state/1",
  "lastApply": {
    "actor": "ci:github",
    "at": "2026-09-21T18:02:11Z",
    "outcome": "done",
    "planId": "pl_7f3a1c07b2e4",
    "writesHash": "sha256:7f3a1c07b2e40b7e1b5fb0db0495289637160b05128b1dcdbaf3d3f1a4025f1a"
  },
  "lineage": "b0a1c6e2d4f68a13",
  "portalId": 2222222,
  "resources": {
    "group:companies/billing": {
      "base": {
        "label": "Billing"
      },
      "id": "billing",
      "normVersion": 1,
      "origin": "created",
      "via": "public-api"
    },
    "layout:companies/default": {
      "attested": {
        "at": "2026-09-21T14:10:00Z",
        "by": "dana"
      },
      "baseHash": "sha256:41aa",
      "id": null,
      "normVersion": 1,
      "origin": "created",
      "via": "runbook"
    },
    "property:companies/billing_status": {
      "base": {
        "group": {
          "$ref": "group:companies/billing"
        },
        "label": "Billing status",
        "options": {
          "active": {
            "hidden": false,
            "label": "Active"
          },
          "reseller": {}
        },
        "optionsOrder": ["active", "reseller"]
      },
      "id": "billing_status",
      "normVersion": 1,
      "origin": "adopted",
      "rewrites": {
        "description": {
          "sent": "Where the account stands ",
          "stored": "Where the account stands"
        }
      },
      "via": "public-api"
    },
    "property:companies/region": {
      "base": {
        "label": "Region"
      },
      "id": "sales_region",
      "normVersion": 1,
      "origin": "adopted",
      "via": "public-api"
    },
    "team:sales_emea": {
      "id": "8841",
      "origin": "reference"
    }
  },
  "serial": 42
}
